{
  "slug": "quatre-oeuvres",
  "title": "Les 4 œuvres au programme",
  "description": "Auteurs, titres, dates, objets d'étude et parcours des 4 œuvres intégrales au programme EAF 2026.",
  "accent": "violet",
  "order": 2,
  "estimatedMinutes": 10,
  "cards": [
    {
      "id": "fl-rimbaud-identite",
      "deck": "quatre-oeuvres",
      "front": "Quelle est l'œuvre de Rimbaud au programme, et dans quel objet d'étude s'inscrit-elle ?",
      "back": "**Arthur Rimbaud**, *Cahiers de Douai* (1870).\n\nObjet d'étude : **La poésie du XIXe au XXIe siècle**.\nParcours associé : **« Émancipations créatrices »**.",
      "mnemonic": "Douai 1870 — Rimbaud a 16 ans et veut tout casser.",
      "accent": "violet"
    },
    {
      "id": "fl-rimbaud-parcours",
      "deck": "quatre-oeuvres",
      "front": "Quel est l'enjeu du parcours « Émancipations créatrices » autour des *Cahiers de Douai* ?",
      "back": "Le parcours interroge la manière dont la poésie devient pour Rimbaud un outil d'**affranchissement** : affranchissement des formes poétiques héritées, des contraintes sociales et morales, et d'un regard conventionnel sur le monde. L'écriture est vécue comme une libération radicale.",
      "accent": "violet"
    },
    {
      "id": "fl-rimbaud-idee",
      "deck": "quatre-oeuvres",
      "front": "Quelle est une idée centrale des *Cahiers de Douai* de Rimbaud ?",
      "back": "Les *Cahiers de Douai* sont un recueil de jeunesse (Rimbaud a 15-16 ans) dans lequel le poète **renouvelle la forme du sonnet** tout en exprimant un désir d'aventure, de liberté et de révolte contre la bourgeoisie et l'ordre établi. Le mouvement, la nature et le corps y sont célébrés avec une énergie neuve.",
      "accent": "violet"
    },
    {
      "id": "fl-graffigny-identite",
      "deck": "quatre-oeuvres",
      "front": "Quelle est l'œuvre de Graffigny au programme, et dans quel objet d'étude s'inscrit-elle ?",
      "back": "**Françoise de Graffigny**, *Lettres d'une Péruvienne* (1747).\n\nObjet d'étude : **La littérature d'idées du XVIe au XVIIIe siècle**.\nParcours associé : **« Un nouvel univers s'est offert à mes yeux »**.",
      "mnemonic": "Une Péruvienne en France en 1747 = regard étranger sur les Lumières.",
      "accent": "violet"
    },
    {
      "id": "fl-graffigny-parcours",
      "deck": "quatre-oeuvres",
      "front": "Quel est l'enjeu du parcours « Un nouvel univers s'est offert à mes yeux » autour des *Lettres d'une Péruvienne* ?",
      "back": "Le parcours explore comment le **regard étranger** de Zilia, princesse inca transplantée en France, devient un outil critique : en découvrant la société française des Lumières avec naïveté et acuité, l'héroïne met à nu ses contradictions — notamment l'inégalité des femmes et les travers des mœurs européennes.",
      "accent": "violet"
    },
    {
      "id": "fl-graffigny-idee",
      "deck": "quatre-oeuvres",
      "front": "Quelle est une idée centrale des *Lettres d'une Péruvienne* de Graffigny ?",
      "back": "Le roman épistolaire de Graffigny met en scène **Zilia**, une jeune femme péruvienne arrachée à son pays et à son amour, qui écrit des lettres pour reconstituer son identité. L'œuvre conjugue **critique des inégalités** (notamment celles subies par les femmes) et **défense de l'autonomie féminine** dans l'esprit des Lumières.",
      "accent": "violet"
    },
    {
      "id": "fl-prevost-identite",
      "deck": "quatre-oeuvres",
      "front": "Quelle est l'œuvre de l'abbé Prévost au programme, et dans quel objet d'étude s'inscrit-elle ?",
      "back": "**Abbé Prévost**, *Manon Lescaut* (1731).\n\nObjet d'étude : **Le roman et le récit du XIXe au XXIe siècle**.\nParcours associé : **« Personnages en marge, plaisirs du romanesque »**.\n\n*(C'est le libellé officiel du BO à retenir, même si l'œuvre date du XVIIIe siècle.)*",
      "mnemonic": "Manon 1731 = roman-passion, héros maudit, amour fatal.",
      "accent": "violet"
    },
    {
      "id": "fl-prevost-parcours",
      "deck": "quatre-oeuvres",
      "front": "Quel est l'enjeu du parcours « Personnages en marge, plaisirs du romanesque » autour de *Manon Lescaut* ?",
      "back": "Le parcours s'intéresse aux héros qui se situent **en dehors des normes sociales et morales** : Des Grieux et Manon transgressent les règles de leur société (famille, religion, morale bourgeoise). Leur marginalité est à la fois source de **tragédie** (châtiment, mort) et de **séduction romanesque** pour le lecteur.",
      "accent": "violet"
    },
    {
      "id": "fl-prevost-idee",
      "deck": "quatre-oeuvres",
      "front": "Quelle est une idée centrale de *Manon Lescaut* de l'abbé Prévost ?",
      "back": "*Manon Lescaut* est le récit rétrospectif de Des Grieux, jeune homme de bonne famille qui sacrifie tout — fortune, honneur, avenir — pour une femme fascinante et imprévisible, **Manon**. L'œuvre explore la **passion amoureuse** comme force destructrice, mais aussi la **puissance narrative** du personnage féminin ambigu.",
      "accent": "violet"
    },
    {
      "id": "fl-sarraute-identite",
      "deck": "quatre-oeuvres",
      "front": "Quelle est l'œuvre de Sarraute au programme, et dans quel objet d'étude s'inscrit-elle ?",
      "back": "**Nathalie Sarraute**, *Pour un oui ou pour un non* (1981).\n\nObjet d'étude : **Le théâtre du XVIIe au XXIe siècle**.\nParcours associé : **« La crise du personnage »**.\n\n*Attention : œuvre sous droits (Sarraute † 1999) — aucune citation textuelle.*",
      "mnemonic": "Deux amis, une dispute pour presque rien = tout le théâtre de Sarraute.",
      "accent": "violet"
    },
    {
      "id": "fl-sarraute-parcours",
      "deck": "quatre-oeuvres",
      "front": "Quel est l'enjeu du parcours « La crise du personnage » autour de *Pour un oui ou pour un non* ?",
      "back": "Le parcours interroge comment le théâtre contemporain **remet en cause la notion de personnage** : dans la pièce, H1 et H2 n'ont pas de nom, pas d'identité sociale, pas de biographie — ils sont réduits à des **voix** et à des réactions langagières. Sarraute déconstruit ainsi les conventions du personnage théâtral classique : ni héros, ni caractère défini, mais une présence fragmentée et instable.\n\n*(Paraphrase — œuvre sous droits.)*",
      "accent": "violet"
    },
    {
      "id": "fl-sarraute-idee",
      "deck": "quatre-oeuvres",
      "front": "Quelle est une idée centrale de *Pour un oui ou pour un non* de Sarraute ?",
      "back": "La pièce met en scène deux hommes (H1 et H2) dont l'amitié se fissure à cause d'une remarque apparemment insignifiante. Sarraute y explore les **« tropismes »** : ces mouvements intérieurs imperceptibles qui gouvernent nos relations. Le théâtre devient ainsi le lieu d'une **crise du langage et du lien social**, caractéristique du Nouveau Roman et du théâtre contemporain.\n\n*(Paraphrase — œuvre sous droits, aucune citation textuelle n'est reproduite.)*",
      "accent": "violet"
    }
  ]
}
