{
  "slug": "epreuve-en-bref",
  "title": "L'épreuve en bref",
  "description": "Format, durée, choix des exercices et stratégie globale de l'EAF écrit.",
  "accent": "slate",
  "order": 1,
  "estimatedMinutes": 5,
  "cards": [
    {
      "id": "fl-epreuve-duree",
      "deck": "epreuve-en-bref",
      "front": "Quelle est la durée de l'épreuve écrite du bac de français ?",
      "back": "**4 heures**, coefficient **5**.",
      "mnemonic": "4h = les 4 lettres de « BREF » — mais rien de bref là-dedans.",
      "accent": "slate"
    },
    {
      "id": "fl-epreuve-choix",
      "deck": "epreuve-en-bref",
      "front": "Combien de sujets l'élève doit-il traiter le jour de l'EAF écrit ?",
      "back": "**Un seul sujet** sur les deux proposés : soit le **commentaire de texte**, soit la **dissertation sur œuvre**. Les deux sujets sont soumis simultanément ; l'élève en choisit un.",
      "mnemonic": "Un seul choix, une seule copie — pas question de faire les deux.",
      "accent": "slate"
    },
    {
      "id": "fl-commentaire-def",
      "deck": "epreuve-en-bref",
      "front": "Qu'est-ce qu'un commentaire de texte ?",
      "back": "Un commentaire de texte est une **analyse littéraire organisée** d'un extrait : on identifie les procédés (figures de style, registre, structure…) et on interprète leurs effets pour répondre à une problématique.",
      "accent": "slate"
    },
    {
      "id": "fl-dissertation-def",
      "deck": "epreuve-en-bref",
      "front": "Qu'est-ce qu'une dissertation sur œuvre ?",
      "back": "Une dissertation sur œuvre est un **développement argumenté** qui répond à une question sur une œuvre intégrale au programme, en construisant un raisonnement appuyé sur des exemples précis tirés de l'œuvre et, si possible, d'autres textes.",
      "accent": "slate"
    },
    {
      "id": "fl-commentaire-parties",
      "deck": "epreuve-en-bref",
      "front": "Combien d'axes (parties) comporte le développement d'un commentaire de texte ?",
      "back": "**2 ou 3 axes** (au choix, selon la richesse du texte). Chaque axe contient 2 ou 3 sous-parties : idée directrice → citation → procédé nommé → interprétation.",
      "mnemonic": "2 ou 3 axes, jamais 1, jamais 4.",
      "accent": "slate"
    },
    {
      "id": "fl-dissertation-parties",
      "deck": "epreuve-en-bref",
      "front": "Quelle est la structure classique du développement d'une dissertation ?",
      "back": "**3 parties** selon le plan dialectique : **thèse** (défendre une position), **antithèse** (la nuancer ou la contredire), **synthèse** (dépasser la contradiction). Un plan analytique est également possible selon la question posée.",
      "mnemonic": "Thèse → Antithèse → Synthèse = le triangle d'or de la dissert.",
      "accent": "slate"
    },
    {
      "id": "fl-timing-commentaire",
      "deck": "epreuve-en-bref",
      "front": "Comment gérer son temps pour un commentaire de texte en 4 heures ?",
      "back": "- **~30 min** : lecture attentive, annotation du texte, repérage des procédés et construction du plan\n- **~3h** : rédaction (introduction + développement + conclusion)\n- **~30 min** : relecture et corrections",
      "mnemonic": "30 min lecture + 3h rédaction + 30 min relecture = 4h pile. La rédaction occupe les ¾ du temps.",
      "accent": "slate"
    },
    {
      "id": "fl-timing-dissertation",
      "deck": "epreuve-en-bref",
      "front": "Comment gérer son temps pour une dissertation en 4 heures ?",
      "back": "- **~30 min** : lecture du sujet, problématisation, construction du plan (thèse / antithèse / synthèse) et recherche des exemples\n- **~3h** : rédaction (introduction + 3 parties + conclusion)\n- **~30 min** : relecture et corrections",
      "mnemonic": "Plan solide en 30 min = les 3h de rédaction se passent bien.",
      "accent": "slate"
    }
  ]
}
