{
  "slug": "mouvements-dates",
  "title": "Mouvements & dates",
  "description": "Les 8 grands mouvements littéraires : siècle, dates, caractéristiques et auteurs emblématiques.",
  "accent": "emerald",
  "order": 5,
  "estimatedMinutes": 10,
  "cards": [
    {
      "id": "fl-mouv-humanisme",
      "deck": "mouvements-dates",
      "front": "Qu'est-ce que l'Humanisme ? Dates et auteurs clés.",
      "back": "**XVIe siècle** (env. 1494–1598).\n\nCaractéristiques :\n- Retour aux textes antiques (grec, latin) et valorisation de l'Homme\n- Curiosité universelle, confiance dans la raison et l'éducation\n- Remise en cause des dogmes médiévaux ; dialogue avec la Réforme\n\nAuteurs emblématiques :\n- **Rabelais** (*Gargantua*, 1534 ; *Pantagruel*, 1532)\n- **Montaigne** (*Essais*, 1580–1588)\n- **Ronsard** (*Odes*, 1550 ; *Sonnets pour Hélène*, 1578)\n- **Érasme** (*Éloge de la folie*, 1511)",
      "mnemonic": "HumanisME = l'Homme au centre. XVIe siècle = Rabelais + Montaigne.",
      "accent": "emerald"
    },
    {
      "id": "fl-mouv-baroque",
      "deck": "mouvements-dates",
      "front": "Qu'est-ce que le Baroque ? Dates et auteurs clés.",
      "back": "**Fin XVIe – début XVIIe siècle** (env. 1570–1660).\n\nCaractéristiques :\n- Mouvement, instabilité, illusion, métamorphose\n- Métaphores filées, images foisonnantes, mise en abyme\n- Réaction à l'ordre classique : excès, ornement, complexité\n\nAuteurs emblématiques :\n- **Agrippa d'Aubigné** (*Les Tragiques*, 1616)\n- **Théophile de Viau** (poésie lyrique)\n- **Cyrano de Bergerac** (*L'Autre Monde*, posth. 1657)",
      "mnemonic": "BAROQUE = B pour Bouillonnant, A pour Agité. Tout est mouvement et illusion.",
      "accent": "emerald"
    },
    {
      "id": "fl-mouv-classicisme",
      "deck": "mouvements-dates",
      "front": "Qu'est-ce que le Classicisme ? Dates et auteurs clés.",
      "back": "**XVIIe siècle, règne de Louis XIV** (env. 1660–1685).\n\nCaractéristiques :\n- Raison, ordre, clarté, bienséances\n- Au théâtre : règle des 3 unités (lieu, temps, action), vraisemblance\n- Nature idéalisée, imitation des Anciens, moral et universel\n\nAuteurs emblématiques :\n- **Molière** (*Le Misanthrope*, 1666 ; *L'Avare*, 1668)\n- **Racine** (*Phèdre*, 1677 ; *Andromaque*, 1667)\n- **Corneille** (*Le Cid*, 1637)\n- **La Fontaine** (*Fables*, 1668–1694)\n- **Boileau** (*Art poétique*, 1674)",
      "mnemonic": "Classicisme = ordre + raison + Louis XIV. MOLière RAcine COrneille = MOLRACO.",
      "accent": "emerald"
    },
    {
      "id": "fl-mouv-lumieres",
      "deck": "mouvements-dates",
      "front": "Qu'est-ce que les Lumières ? Dates et auteurs clés.",
      "back": "**XVIIIe siècle** (env. 1715–1789).\n\nCaractéristiques :\n- Raison critique, progrès, tolérance, engagement philosophique\n- Lutte contre l'obscurantisme, la superstition, l'injustice\n- Genres phares : conte philosophique, essai, lettre, encyclopédie\n\nAuteurs emblématiques :\n- **Voltaire** (*Candide*, 1759 ; *Zadig*, 1747)\n- **Rousseau** (*Du Contrat social*, 1762 ; *Émile*, 1762)\n- **Montesquieu** (*Lettres persanes*, 1721 ; *L'Esprit des lois*, 1748)\n- **Diderot** (*Encyclopédie*, 1751–1772)",
      "mnemonic": "Lumières = VRaMD : Voltaire, Rousseau, Montesquieu, Diderot. XVIIIe siècle.",
      "accent": "emerald"
    },
    {
      "id": "fl-mouv-romantisme",
      "deck": "mouvements-dates",
      "front": "Qu'est-ce que le Romantisme ? Dates et auteurs clés.",
      "back": "**XIXe siècle, 1re moitié** (env. 1820–1850).\n\nCaractéristiques :\n- Primauté du sentiment, du moi, de la mélancolie (*mal du siècle*)\n- Nature comme miroir de l'âme, exotisme, idéal inaccessible\n- Rejet des règles classiques, liberté des formes (drame romantique)\n\nAuteurs emblématiques :\n- **Victor Hugo** (*Les Misérables*, 1862 ; *Hernani*, 1830 ; *Les Contemplations*, 1856)\n- **Lamartine** (*Méditations poétiques*, 1820)\n- **Alfred de Vigny** (*Chatterton*, 1835)\n- **Alfred de Musset** (*La Confession d'un enfant du siècle*, 1836)\n- **Gérard de Nerval** (*Les Chimères*, 1854)",
      "mnemonic": "Romantisme = le MOAN : Mélancolie, mOi, Amour, Nature. Hugo + Lamartine en tête.",
      "accent": "emerald"
    },
    {
      "id": "fl-mouv-realisme-naturalisme",
      "deck": "mouvements-dates",
      "front": "Qu'est-ce que le Réalisme et le Naturalisme ? Dates et auteurs clés.",
      "back": "**Réalisme** : XIXe siècle, 2e moitié (env. 1830–1870).\n- Peinture fidèle du réel, des milieux sociaux, description minutieuse\n- Roman comme « miroir » de la société\n- **Balzac** (*Le Père Goriot*, 1835), **Stendhal** (*Le Rouge et le Noir*, 1830), **Flaubert** (*Madame Bovary*, 1857)\n\n**Naturalisme** : fin XIXe siècle (env. 1865–1900).\n- Déterminisme social et biologique, influence du milieu et de l'hérédité\n- Roman scientifique, enquête sociale\n- **Zola** (*Germinal*, 1885 ; *L'Assommoir*, 1877), **Maupassant**",
      "mnemonic": "Réalisme → Naturalisme : Balzac/Flaubert → Zola. Du miroir au scalpel.",
      "accent": "emerald"
    },
    {
      "id": "fl-mouv-symbolisme",
      "deck": "mouvements-dates",
      "front": "Qu'est-ce que le Symbolisme ? Dates et auteurs clés.",
      "back": "**Fin XIXe siècle** (env. 1857–1900).\n\nCaractéristiques :\n- Suggestion plutôt qu'explication directe : le symbole remplace la description\n- Musicalité du vers, synesthésies (correspondances entre les sens)\n- Intériorité, mystère, refus du positivisme et du réalisme\n\nAuteurs emblématiques :\n- **Baudelaire** (*Les Fleurs du Mal*, 1857) — précurseur\n- **Verlaine** (*Romances sans paroles*, 1874 ; *Sagesse*, 1880)\n- **Rimbaud** (*Illuminations*, posth. 1886 ; *Une saison en enfer*, 1873)\n- **Mallarmé** (*Poésies*, 1887)",
      "mnemonic": "Symbolisme = suggérer, ne pas dire. BVRM : Baudelaire, Verlaine, Rimbaud, Mallarmé.",
      "accent": "emerald"
    },
    {
      "id": "fl-mouv-surrealisme",
      "deck": "mouvements-dates",
      "front": "Qu'est-ce que le Surréalisme ? Dates et auteurs clés.",
      "back": "**XXe siècle** (à partir de 1924).\n\nCaractéristiques :\n- Libération de l'inconscient, écriture automatique, rêve, hasard objectif\n- Refus de la raison et de la logique comme seuls guides\n- Engagement politique (notamment communiste pour Aragon, Éluard)\n\nAuteurs emblématiques :\n- **André Breton** (*Manifeste du surréalisme*, 1924) — fondateur\n- **Louis Aragon** (*Le Paysan de Paris*, 1926)\n- **Paul Éluard** (*Capitale de la douleur*, 1926)\n- **Robert Desnos** (*Corps et biens*, 1930)",
      "mnemonic": "SurréalisME 1924 = Breton fonde le mouvement. Rêve + inconscient = clés.",
      "accent": "emerald"
    }
  ]
}
