{
  "slug": "registres",
  "title": "Registres littéraires",
  "description": "Les 8 registres essentiels de l'EAF : définition, procédés caractéristiques et effet sur le lecteur.",
  "accent": "red",
  "order": 6,
  "estimatedMinutes": 10,
  "cards": [
    {
      "id": "fl-reg-lyrique",
      "deck": "registres",
      "front": "Qu'est-ce que le registre lyrique ?",
      "back": "**Expression des sentiments personnels** (amour, mélancolie, deuil, joie) à la première personne, dans une écriture musicale et émotionnelle.\n\n**Procédés caractéristiques :**\n- Pronoms de la 1re personne (« je », « mon », « ma »)\n- Lexique émotionnel et sensoriel\n- Apostrophes, exclamations, questions rhétoriques\n- Rythme musical, images poétiques\n\n**Effet recherché :** Créer une communion émotionnelle entre le poète et le lecteur, susciter l'empathie ou le partage d'une émotion intime.\n\n*Exemple* : « Ô temps, suspends ton vol ! et vous, heures propices, / Suspendez votre cours ! » (Lamartine, *Le Lac*, *Méditations poétiques*, 1820).",
      "mnemonic": "Lyrique = le JE qui chante ses émotions. Musique + sentiments + 1re personne.",
      "accent": "red"
    },
    {
      "id": "fl-reg-tragique",
      "deck": "registres",
      "front": "Qu'est-ce que le registre tragique ?",
      "back": "**Représentation d'un destin inéluctable** : le héros est confronté à des forces qui le dépassent (dieux, fatalité, passion), et sa chute est irréversible.\n\n**Procédés caractéristiques :**\n- Lexique de la fatalité, de la mort, de l'impossibilité (« il faut », « je dois »)\n- Opposition entre la volonté du héros et les forces qui l'écrasent\n- Champ lexical de la souffrance et de l'impuissance\n- Solennité du ton, ampleur syntaxique\n\n**Effet recherché :** Terreur et pitié — le lecteur ou spectateur est saisi par la grandeur et la souffrance du héros face à un sort dont il ne peut s'échapper.\n\n*Exemple* : « Je le vis, je rougis, je pâlis à sa vue ; / Un trouble s'éleva dans mon âme éperdue. » (Racine, *Phèdre*, acte I, scène 3, 1677).",
      "mnemonic": "Tragique = fatalité + chute inévitable. Phèdre, Andromaque : aucune issue.",
      "accent": "red"
    },
    {
      "id": "fl-reg-comique",
      "deck": "registres",
      "front": "Qu'est-ce que le registre comique ?",
      "back": "**Vise à faire rire** le lecteur ou le spectateur par différents types de comique : de situation, de caractère, de mots, de gestes (farce).\n\n**Procédés caractéristiques :**\n- Quiproquos, malentendus, répétitions absurdes (comique de situation)\n- Caricature d'un défaut exagéré (comique de caractère : l'avare, le jaloux)\n- Jeux de mots, calembours (comique de mots)\n- Décalage entre le niveau de langue et la situation\n\n**Effet recherché :** Provoquer le rire, mais souvent aussi faire réfléchir sur les travers humains (critique indirecte des vices et des mœurs).\n\n*Exemple* : « Harpagon : — Et sans dot ? […] — Sans dot. — Ah ! je vous dis sans dot. — Sans dot. » (Molière, *L'Avare*, acte II, scène 5, 1668) — la répétition obsessionnelle crée un comique de caractère.",
      "mnemonic": "Comique = rire, mais rire pour réfléchir. Molière = maître du genre.",
      "accent": "red"
    },
    {
      "id": "fl-reg-satirique",
      "deck": "registres",
      "front": "Qu'est-ce que le registre satirique ?",
      "back": "**Critique sociale, politique ou morale** par le rire, l'ironie ou l'exagération. Le satiriste attaque les vices, les institutions ou les individus pour les corriger ou les dénoncer.\n\n**Procédés caractéristiques :**\n- Ironie, antiphrase (dire le contraire de ce qu'on pense)\n- Hyperbole, caricature\n- Ton mordant, vocabulaire dépréciatif\n- Mise en scène d'un regard naïf ou étranger (procédé du « regard étranger »)\n\n**Effet recherché :** Provoquer la réflexion critique par le rire ou le sourire ; dénoncer les absurdités d'une société ou d'un pouvoir.\n\n*Exemple* : « Selon que vous serez puissant ou misérable, / Les jugements de cour vous rendront blanc ou noir. » (La Fontaine, *Les Animaux malades de la peste*, *Fables*, VII, 1, 1678) — la satire directe des inégalités de la justice sous l'Ancien Régime.",
      "mnemonic": "Satirique = critiquer en riant. Voltaire ironise, Molière caricature.",
      "accent": "red"
    },
    {
      "id": "fl-reg-polemique",
      "deck": "registres",
      "front": "Qu'est-ce que le registre polémique ?",
      "back": "**Prise de position tranchante** et volonté de convaincre par l'attaque directe d'une idée, d'une institution ou d'une personne. Le ton est combatif, passionné, parfois virulent.\n\n**Procédés caractéristiques :**\n- Questions rhétoriques et apostrophes agressives\n- Antithèses marquées, accumulations dénonciatives\n- Vocabulaire violent ou péjoratif envers la cible\n- Ton exclamatif, prise en charge assumée par le « je » ou le « nous »\n\n**Effet recherché :** Indigner le lecteur, le mobiliser contre une cause ou une idée ; créer un sentiment d'urgence et d'injustice à combattre.\n\n*Exemple* : « J'accuse !… » (Zola, *J'accuse*, *L'Aurore*, 13 janvier 1898) — l'attaque nominative et directe est l'emblème du registre polémique.",
      "mnemonic": "Polémique = attaquer pour convaincre. Ton violent + engagement total.",
      "accent": "red"
    },
    {
      "id": "fl-reg-pathetique",
      "deck": "registres",
      "front": "Qu'est-ce que le registre pathétique ?",
      "back": "**Suscite la pitié et la compassion** en représentant des scènes de souffrance, de misère ou de détresse. Il cherche à émouvoir profondément, parfois jusqu'aux larmes.\n\n**Procédés caractéristiques :**\n- Lexique de la souffrance, de la douleur, de l'impuissance\n- Scènes de misère physique ou morale\n- Ton implorant, supplications, gémissements\n- Détails concrets qui rendent la souffrance tangible\n\n**Effet recherché :** Émouvoir le lecteur, provoquer sa compassion et sa solidarité envers les victimes ou les personnages souffrants.\n\n*Exemple* : « Et quand j'arriverai, je mettrai sur ta tombe / Un bouquet de houx vert et de bruyère en fleur. » (Hugo, *Demain, dès l'aube*, *Les Contemplations*, 1856) — Hugo marche vers la tombe de sa fille Léopoldine ; la simplicité du bouquet rend la douleur d'autant plus bouleversante.",
      "mnemonic": "Pathétique = faire pleurer. Souffrance visible + compassion du lecteur.",
      "accent": "red"
    },
    {
      "id": "fl-reg-epique",
      "deck": "registres",
      "front": "Qu'est-ce que le registre épique ?",
      "back": "**Récit de hauts faits héroïques**, de batailles ou d'exploits collectifs, dans une ampleur solennelle qui célèbre la grandeur humaine ou divine.\n\n**Procédés caractéristiques :**\n- Hyperboles et amplifications (chiffres immenses, métaphores grandioses)\n- Accumulations et énumérations qui rendent l'action colossale\n- Héros collectifs ou individuels aux dimensions surhumaines\n- Rythme ample, syntaxe étendue, tonalité solennelle\n\n**Effet recherché :** Impressionner, susciter l'admiration et l'enthousiasme ; donner une dimension grandiose aux événements racontés.\n\n*Exemple* : « Waterloo ! Waterloo ! Waterloo ! morne plaine ! / Comme une onde qui bout dans une urne trop pleine, / Dans un gouffre fatal, le choc s'est englouti. » (Hugo, *Les Châtiments*, *L'Expiation*, 1853).",
      "mnemonic": "Épique = tout est grand, héroïque, collectif. Hyperboles + ampleur + héros.",
      "accent": "red"
    },
    {
      "id": "fl-reg-fantastique",
      "deck": "registres",
      "front": "Qu'est-ce que le registre fantastique ?",
      "back": "**Irruption du surnaturel dans un cadre réaliste**, créant une hésitation irrésolue entre explication rationnelle et explication irrationnelle. Le lecteur (et souvent le personnage) ne sait pas si ce qu'il lit est réel ou illusoire.\n\n**Procédés caractéristiques :**\n- Atmosphère angoissante, descriptions inquiétantes de détails ordinaires\n- Hésitation du narrateur et des personnages face aux événements\n- Vocabulaire de l'incertitude (« semblait », « peut-être », « comme si »)\n- Basculement progressif du familier vers l'étrange\n\n**Effet recherché :** Créer une angoisse diffuse ; maintenir le lecteur dans un état d'incertitude troublante, entre fascination et peur.\n\n*Exemple (paraphrase)* : Dans *Le Horla* (Maupassant, 1887), le narrateur tient un journal où il oscille constamment entre deux explications : est-il fou, ou l'être invisible — le Horla — existe-t-il réellement ? Cette hésitation irrésolue est le moteur même du fantastique.",
      "mnemonic": "Fantastique = le surnaturel dans le réel, et on ne sait jamais. Maupassant = maître.",
      "accent": "red"
    }
  ]
}
