{
  "slug": "figures-cles",
  "title": "Figures clés",
  "description": "Les 12 figures de style incontournables pour l'EAF : définition précise + exemple du domaine public.",
  "accent": "amber",
  "order": 4,
  "estimatedMinutes": 10,
  "cards": [
    {
      "id": "fl-fig-metaphore",
      "deck": "figures-cles",
      "front": "Qu'est-ce qu'une métaphore ?",
      "back": "**Comparaison implicite** entre deux éléments sans outil comparatif (sans « comme », « tel que »…). Elle assimile directement une réalité à une autre, créant une image forte.\n\n*Exemple* : « Ô toison, moutonnant jusque sur l'encolure ! » (Baudelaire, *La Chevelure*, *Les Fleurs du Mal*, 1857) — la chevelure comparée implicitement à une toison laineuse.",
      "mnemonic": "Métaphore = fusionner deux images sans passerelle. Pas de « comme ».",
      "accent": "amber"
    },
    {
      "id": "fl-fig-comparaison",
      "deck": "figures-cles",
      "front": "Qu'est-ce qu'une comparaison ?",
      "back": "Rapprochement **explicite** de deux éléments à l'aide d'un **outil comparatif** (comme, tel, ainsi que, semblable à, pareil à…). Elle comporte un comparé, un comparant et un outil.\n\n*Exemple* : « Comme des lyres, je tirais les élastiques / De mes souliers blessés » (Rimbaud, *Ma Bohème*, *Cahiers de Douai*, 1870) — les élastiques des souliers (comparé) sont comparés à des lyres (comparant) grâce à l'outil « comme ».",
      "mnemonic": "Comparaison = un pont visible entre deux images. Cherche « comme », « tel que »…",
      "accent": "amber"
    },
    {
      "id": "fl-fig-metonymie-synecdoque",
      "deck": "figures-cles",
      "front": "Qu'est-ce que la métonymie ? Et la synecdoque ?",
      "back": "**Métonymie** : désigner une chose par une autre qui lui est associée (contenant/contenu, cause/effet, lieu/institution).\n*Exemple* : « Boire un verre » — le verre (contenant) désigne le liquide (contenu).\n\n**Synecdoque** : variante de la métonymie où la partie désigne le tout (ou le tout la partie).\n*Exemple* : « Vingt voiles sur la mer » (exemple classique des traités de rhétorique) — les voiles (partie) désignent les bateaux (tout).",
      "mnemonic": "Méto = glissement logique entre deux réalités liées. Synecdoque = partie pour le tout.",
      "accent": "amber"
    },
    {
      "id": "fl-fig-hyperbole",
      "deck": "figures-cles",
      "front": "Qu'est-ce qu'une hyperbole ?",
      "back": "**Exagération** volontaire à des fins expressives : amplifier au-delà du réel pour frapper le lecteur, exprimer une émotion intense ou produire un effet comique.\n\n*Exemple* : « Va, cours, vole et nous venge ! » (Corneille, *Le Cid*, acte I, scène 6, 1637) — l'accumulation de trois verbes d'action croissants crée une hyperbole de l'urgence.",
      "mnemonic": "Hyperbole = tout est exagéré à l'extrême. « Mourir de rire » = exemple du quotidien.",
      "accent": "amber"
    },
    {
      "id": "fl-fig-litote",
      "deck": "figures-cles",
      "front": "Qu'est-ce qu'une litote ?",
      "back": "**Dire moins pour suggérer plus** : atténuer l'expression pour en renforcer la portée. La litote nie le contraire de ce qu'elle veut affirmer.\n\n*Exemple* : « Va, je ne te hais point. » (Corneille, *Le Cid*, acte III, scène 4, 1637) — Chimène dit à Rodrigue qu'elle ne le hait pas, ce qui signifie implicitement qu'elle l'aime toujours.",
      "mnemonic": "Litote = dire moins pour dire plus fort. « Je ne te hais point » = je t'aime.",
      "accent": "amber"
    },
    {
      "id": "fl-fig-euphemisme",
      "deck": "figures-cles",
      "front": "Qu'est-ce qu'un euphémisme ?",
      "back": "**Atténuation** d'une réalité dure, choquante ou taboue par une formulation plus douce ou indirecte, pour ménager le lecteur ou l'interlocuteur.\n\n*Exemple* : « Il a rendu l'âme » — formule classique qui atténue la brutalité de la mort en la présentant comme un acte volontaire et noble. Autre exemple courant : « une personne en situation irrégulière » pour désigner un sans-papier.",
      "mnemonic": "Euphémisme = adoucir la réalité. « Disparaître » au lieu de « mourir ».",
      "accent": "amber"
    },
    {
      "id": "fl-fig-antiphrase",
      "deck": "figures-cles",
      "front": "Qu'est-ce qu'une antiphrase (ironie) ?",
      "back": "**Dire le contraire de ce que l'on pense**, en comptant sur le contexte pour que le destinataire comprenne la véritable intention. L'antiphrase est le procédé de base de l'**ironie** et de la **satire**.\n\n*Exemple* : « Rien n'était si beau, si leste, si brillant, si bien ordonné que les deux armées. » (Voltaire, *Candide*, ch. 3, 1759) — l'éloge de la « beauté » des armées est une antiphrase : Voltaire décrit en réalité le carnage de la guerre.",
      "mnemonic": "Antiphrase = dire blanc pour signifier noir. Contexte ironique indispensable.",
      "accent": "amber"
    },
    {
      "id": "fl-fig-anaphore",
      "deck": "figures-cles",
      "front": "Qu'est-ce qu'une anaphore ?",
      "back": "**Répétition d'un mot ou d'un groupe de mots en début** de vers, de phrase ou de proposition successifs. Elle crée un effet de rythme, d'insistance ou d'amplification.\n\n*Exemple* : « Waterloo ! Waterloo ! Waterloo ! morne plaine ! » (Hugo, *Les Châtiments*, *L'Expiation*, 1853) — la triple répétition de « Waterloo » martèle la défaite avec une intensité dramatique.",
      "mnemonic": "Anaphore = même mot en TÊTE de chaque segment. Effet de marteau.",
      "accent": "amber"
    },
    {
      "id": "fl-fig-chiasme",
      "deck": "figures-cles",
      "front": "Qu'est-ce qu'un chiasme ?",
      "back": "**Croisement de deux structures parallèles** selon le schéma AB / BA : les éléments de la seconde proposition reprennent ceux de la première dans l'ordre inverse, créant une symétrie en miroir.\n\n*Exemple* : « Il faut manger pour vivre et non pas vivre pour manger. » (Molière, *L'Avare*, acte III, scène 1, 1668) — structure « manger / vivre » puis « vivre / manger ».",
      "mnemonic": "Chiasme = croisement en X. AB puis BA — comme une croix (χ grec).",
      "accent": "amber"
    },
    {
      "id": "fl-fig-oxymore",
      "deck": "figures-cles",
      "front": "Qu'est-ce qu'un oxymore ?",
      "back": "**Association en un même groupe de deux termes contradictoires**, créant une tension sémantique qui force une lecture nouvelle de la réalité, souvent pour exprimer une émotion complexe ou un paradoxe.\n\n*Exemple* : « Cette obscure clarté qui tombe des étoiles » (Corneille, *Le Cid*, acte IV, scène 3, 1637) — « obscure clarté » unit deux contraires pour évoquer la lumière ambiguë de la nuit étoilée.",
      "mnemonic": "Oxymore = mariage de contraires. Comme « silence assourdissant ».",
      "accent": "amber"
    },
    {
      "id": "fl-fig-personnification",
      "deck": "figures-cles",
      "front": "Qu'est-ce qu'une personnification (ou prosopopée) ?",
      "back": "**Attribution de traits humains** (pensées, paroles, sentiments, actions) à un être non humain : animal, objet, abstraction, phénomène naturel. La **prosopopée** est la forme la plus développée : faire parler une entité absente ou morte.\n\n*Exemple* : « Ô Mort, vieux capitaine, il est temps ! levons l'ancre ! » (Baudelaire, *Le Voyage*, *Les Fleurs du Mal*, 1857) — la Mort est interpellée comme un capitaine, à qui on s'adresse directement.",
      "mnemonic": "Personnification = prêter une âme humaine à ce qui n'en a pas.",
      "accent": "amber"
    },
    {
      "id": "fl-fig-antithese",
      "deck": "figures-cles",
      "front": "Qu'est-ce qu'une antithèse ?",
      "back": "**Opposition de deux termes, idées ou images contraires** dans une même construction syntaxique, pour mettre en relief un contraste et créer un effet de tension ou de dualité.\n\n*Exemple* : « Un souffle, une ombre, un rien, tout lui donnait la fièvre. » (La Fontaine, *Le Lièvre et les Grenouilles*, *Fables*, 1668) — l'opposition entre la légèreté du « rien » et la violence de « la fièvre » souligne la nature peureuse du lièvre.",
      "mnemonic": "Antithèse = deux contraires face à face dans la même phrase.",
      "accent": "amber"
    }
  ]
}
