{
  "slug": "methode-express",
  "title": "Méthode express",
  "description": "Les étapes clés du commentaire et de la dissertation pour ne rien oublier le jour J.",
  "accent": "blue",
  "order": 3,
  "estimatedMinutes": 8,
  "cards": [
    {
      "id": "fl-commentaire-etape1",
      "deck": "methode-express",
      "front": "Étape 1 du commentaire : que faire pendant les 30 premières minutes ?",
      "back": "**Lecture et annotation du texte** :\n- Lire deux fois (une lecture globale, une lecture analytique)\n- Souligner les mots forts, les figures de style repérables, les répétitions\n- Annoter dans les marges : registre, tonalité, procédés, effets\n- Dégager le **mouvement** du texte (comment il progresse)\n- Trouver une **problématique** (question directrice)",
      "mnemonic": "Avant d'écrire, lire deux fois et annoter = gagner du temps pour la suite.",
      "accent": "blue"
    },
    {
      "id": "fl-commentaire-etape2",
      "deck": "methode-express",
      "front": "Étape 2 du commentaire : comment construire le plan ?",
      "back": "**Construction du plan en 2 ou 3 axes thématiques** :\n- Regrouper les observations par thèmes (pas par ordre d'apparition dans le texte)\n- Chaque axe = **une idée générale** sur le texte (pas un résumé)\n- Chaque axe contient 2 ou 3 sous-parties\n- Vérifier que les axes répondent à la problématique\n- Écrire le plan au brouillon avec les citations retenues",
      "mnemonic": "Plan thématique, pas plan linéaire — regrouper les procédés par idée.",
      "accent": "blue"
    },
    {
      "id": "fl-commentaire-etape3",
      "deck": "methode-express",
      "front": "Étape 3 du commentaire : comment rédiger l'introduction ?",
      "back": "L'introduction est **un seul paragraphe** en 4 temps :\n1. **Accroche** : contexte (genre, mouvement littéraire, époque)\n2. **Présentation** : auteur, titre, date, situation de l'extrait\n3. **Problématique** : la question directrice (ex. : « Comment… ? »)\n4. **Annonce du plan** : les axes dans l'ordre (ex. : « Nous verrons d'abord… puis… enfin… »)",
      "mnemonic": "Accroche → Présentation → Problématique → Plan = APPP.",
      "accent": "blue"
    },
    {
      "id": "fl-commentaire-etape4",
      "deck": "methode-express",
      "front": "Étape 4 du commentaire : comment rédiger une sous-partie du développement ?",
      "back": "Chaque sous-partie suit la structure **ICPI** :\n1. **Idée directrice** : phrase d'affirmation (ce qu'on va montrer)\n2. **Citation** : entre guillemets, avec référence si possible\n3. **Procédé nommé** : ex. « une métaphore », « une anaphore », « le registre lyrique »\n4. **Interprétation** : l'effet produit sur le lecteur, le sens apporté au texte",
      "mnemonic": "ICPI (aide-mémoire) : Idée → Citation → Procédé → Interprétation.",
      "accent": "blue"
    },
    {
      "id": "fl-commentaire-etape5",
      "deck": "methode-express",
      "front": "Étape 5 du commentaire : comment rédiger la conclusion ?",
      "back": "La conclusion se fait en **2 temps** :\n1. **Bilan** : résumer les grandes réponses apportées par les axes (répondre à la problématique en synthèse)\n2. **Ouverture** : proposer un élargissement — une autre œuvre du même auteur, un autre texte du même mouvement, ou une question plus large",
      "mnemonic": "Bilan = fermer la porte ; Ouverture = en ouvrir une autre.",
      "accent": "blue"
    },
    {
      "id": "fl-dissertation-etape1",
      "deck": "methode-express",
      "front": "Étape 1 de la dissertation : comment lire et problématiser le sujet ?",
      "back": "**Lire et problématiser** :\n- Lire le sujet deux fois, souligner les mots clés\n- Définir les termes importants du sujet\n- Reformuler la question : *qu'est-ce qu'on me demande vraiment de discuter ?*\n- Construire une **problématique** : une tension, un paradoxe, un « oui mais… » à explorer\n- Éviter de simplement répondre « oui » ou « non » sans nuance",
      "mnemonic": "Un bon sujet de dissert cache toujours une tension — la trouver, c'est gagner.",
      "accent": "blue"
    },
    {
      "id": "fl-dissertation-etape2",
      "deck": "methode-express",
      "front": "Étape 2 de la dissertation : comment construire le plan dialectique ?",
      "back": "**Construire le plan thèse / antithèse / synthèse** :\n- **Thèse** : défendre la position affirmée par le sujet (arguments + exemples de l'œuvre)\n- **Antithèse** : nuancer, contredire ou compléter (arguments + autres exemples)\n- **Synthèse** : dépasser l'opposition, proposer une vision plus complexe\n- Pour chaque partie : trouver **2 ou 3 arguments** avec un **exemple précis** par argument",
      "mnemonic": "Thèse : oui. Antithèse : mais. Synthèse : en fait…",
      "accent": "blue"
    },
    {
      "id": "fl-dissertation-etape3",
      "deck": "methode-express",
      "front": "Étape 3 de la dissertation : comment utiliser les exemples ?",
      "back": "Chaque argument doit être **illustré par un exemple précis** :\n- Citer une scène, un personnage, un épisode de l'œuvre au programme\n- Nommer le passage (chapitre, acte, moment clé) sans forcément citer mot pour mot\n- Ajouter si possible un **exemple d'ouverture** (autre œuvre, autre auteur du même mouvement)\n- Toujours **analyser l'exemple** : ne pas se contenter de le citer, montrer en quoi il prouve l'argument",
      "mnemonic": "Exemple sans analyse = anecdote. Exemple analysé = argument.",
      "accent": "blue"
    },
    {
      "id": "fl-intro-structure",
      "deck": "methode-express",
      "front": "Quelle est la structure exacte d'une introduction (commentaire ou dissertation) ?",
      "back": "**4 étapes en 1 seul paragraphe** :\n1. **Accroche** : contextualiser (genre, mouvement, époque, citation générale)\n2. **Présentation** : auteur + titre + date + situation/enjeu du texte ou du sujet\n3. **Problématique** : question directrice (souvent formulée avec « Comment… ? » ou « Dans quelle mesure… ? »)\n4. **Annonce du plan** : les grandes parties dans l'ordre, en une phrase",
      "mnemonic": "4 étapes, 1 seul paragraphe — ne jamais sauter une ligne dans l'intro.",
      "accent": "blue"
    },
    {
      "id": "fl-conclusion-structure",
      "deck": "methode-express",
      "front": "Quelle est la structure d'une conclusion (commentaire ou dissertation) ?",
      "back": "**2 étapes en 1 seul paragraphe** :\n1. **Bilan synthétique** : résumer les axes ou parties en répondant directement à la problématique (sans répéter les détails)\n2. **Ouverture** : proposer une question plus large, un rapprochement avec une autre œuvre, un autre auteur, ou une réflexion sur le genre / le mouvement\n\n*Ne jamais introduire de nouvelles idées dans la conclusion.*",
      "mnemonic": "Conclusion = fermer + ouvrir. Surtout ne pas juste résumer.",
      "accent": "blue"
    }
  ]
}
